{
  "schema": {
    "id": "kg-agent.graph-storage",
    "version": "1.0.0"
  },
  "registry": {
    "version": "release-schema-v1",
    "release": "PanKgraph_08_04",
    "identity_strength": "schema_and_anchors",
    "nodes": {
      "OCR_peak": [
        "assembly",
        "chr",
        "data_source",
        "data_version",
        "description",
        "end_loc",
        "genome_assembly",
        "id",
        "start_loc",
        "type"
      ],
      "regulatory_elements": [
        "assembly",
        "chr",
        "data_source",
        "data_version",
        "description",
        "end_loc",
        "genome_assembly",
        "id",
        "start_loc",
        "type"
      ],
      "disease": [
        "data_source",
        "data_source_url",
        "data_version",
        "description",
        "id",
        "name",
        "synonyms"
      ],
      "ontology": [
        "data_source",
        "data_source_url",
        "data_version",
        "description",
        "id",
        "name",
        "synonyms"
      ],
      "Gene": [
        "alt_id_entrez",
        "assembly",
        "chr",
        "data_source",
        "data_source_url",
        "data_version",
        "description",
        "end_loc",
        "ensembl_gene_version",
        "gc_content",
        "gene_type",
        "genome_assembly",
        "hgnc_id",
        "hgnc_symbol",
        "id",
        "karyotype_band",
        "name",
        "start_loc",
        "strand",
        "synonyms"
      ],
      "sequence_variant": [
        "HGVS_name",
        "alt",
        "assembly",
        "chr",
        "common_snp",
        "data_source",
        "data_version",
        "end_loc",
        "freq",
        "genome_assembly",
        "id",
        "in_3prime_gene_region",
        "in_3prime_utr",
        "in_5prime_gene_region",
        "in_5prime_utr",
        "in_acceptor_splice_site",
        "in_donor_splice_site",
        "in_intron",
        "non_synonymous_frameshift",
        "non_synonymous_missense",
        "non_synonymous_nonsense",
        "ref",
        "start_loc",
        "type",
        "variant_suspect_reason"
      ],
      "variants": [
        "HGVS_name",
        "alt",
        "assembly",
        "chr",
        "common_snp",
        "data_source",
        "data_version",
        "end_loc",
        "freq",
        "genome_assembly",
        "id",
        "in_3prime_gene_region",
        "in_3prime_utr",
        "in_5prime_gene_region",
        "in_5prime_utr",
        "in_acceptor_splice_site",
        "in_donor_splice_site",
        "in_intron",
        "non_synonymous_frameshift",
        "non_synonymous_missense",
        "non_synonymous_nonsense",
        "ref",
        "start_loc",
        "type",
        "variant_suspect_reason"
      ],
      "GO_term": [
        "data_source",
        "data_source_url",
        "data_version",
        "description",
        "go_domain",
        "id",
        "name"
      ],
      "donor": [
        "aab_state",
        "age",
        "bmi",
        "c_peptide_ng_ml",
        "cause_of_death",
        "center_donor_id",
        "creation_date",
        "data_source",
        "data_source_url",
        "data_version",
        "derived_diabetes_status",
        "diabetes_duration",
        "diabetes_type",
        "donation_type",
        "family_history_of_diabetes",
        "gender",
        "hba1c_percentage",
        "hla_status",
        "hla_typing",
        "hospital_stay_hours",
        "id",
        "other_disease_records",
        "other_therapy",
        "pancdb_id",
        "pankbase_id",
        "predicted_genetic_ancestry",
        "race",
        "rrid",
        "sex_at_birth",
        "t1d_stage"
      ],
      "provenance": [
        "age",
        "bmi",
        "data_source",
        "data_version",
        "derived_diabetes_status",
        "diabetes_duration",
        "diabetes_type",
        "gender",
        "id",
        "race",
        "sex_at_birth",
        "t1d_stage"
      ],
      "snv": [
        "HGVS_name",
        "alt",
        "assembly",
        "chr",
        "common_snp",
        "data_source",
        "data_version",
        "end_loc",
        "freq",
        "genome_assembly",
        "id",
        "in_3prime_gene_region",
        "in_3prime_utr",
        "in_5prime_gene_region",
        "in_5prime_utr",
        "in_acceptor_splice_site",
        "in_donor_splice_site",
        "in_intron",
        "non_synonymous_frameshift",
        "non_synonymous_missense",
        "non_synonymous_nonsense",
        "ref",
        "start_loc",
        "type",
        "variant_suspect_reason"
      ],
      "deletion": [
        "HGVS_name",
        "alt",
        "assembly",
        "chr",
        "common_snp",
        "data_source",
        "data_version",
        "end_loc",
        "freq",
        "genome_assembly",
        "id",
        "in_3prime_gene_region",
        "in_3prime_utr",
        "in_5prime_gene_region",
        "in_5prime_utr",
        "in_acceptor_splice_site",
        "in_donor_splice_site",
        "in_intron",
        "non_synonymous_frameshift",
        "non_synonymous_missense",
        "non_synonymous_nonsense",
        "ref",
        "start_loc",
        "type",
        "variant_suspect_reason"
      ],
      "indel": [
        "HGVS_name",
        "alt",
        "assembly",
        "chr",
        "common_snp",
        "data_source",
        "data_version",
        "end_loc",
        "freq",
        "genome_assembly",
        "id",
        "in_3prime_gene_region",
        "in_3prime_utr",
        "in_5prime_gene_region",
        "in_5prime_utr",
        "in_acceptor_splice_site",
        "in_donor_splice_site",
        "in_intron",
        "non_synonymous_frameshift",
        "non_synonymous_missense",
        "non_synonymous_nonsense",
        "ref",
        "start_loc",
        "type",
        "variant_suspect_reason"
      ],
      "insertion": [
        "HGVS_name",
        "alt",
        "assembly",
        "chr",
        "common_snp",
        "data_source",
        "data_version",
        "end_loc",
        "freq",
        "genome_assembly",
        "id",
        "in_3prime_gene_region",
        "in_3prime_utr",
        "in_5prime_gene_region",
        "in_5prime_utr",
        "in_acceptor_splice_site",
        "in_donor_splice_site",
        "in_intron",
        "non_synonymous_frameshift",
        "non_synonymous_missense",
        "non_synonymous_nonsense",
        "ref",
        "start_loc",
        "type",
        "variant_suspect_reason"
      ],
      "kegg": [
        "data_source",
        "data_source_url",
        "data_version",
        "description",
        "id",
        "name"
      ],
      "Sample_node": [
        "anatomical_structure",
        "contact",
        "data_modality",
        "data_source",
        "data_version",
        "id",
        "note"
      ],
      "anatomical_structure": [
        "category",
        "data_source",
        "data_source_url",
        "data_version",
        "description",
        "id",
        "name"
      ],
      "data_modality": [
        "data_source",
        "data_version",
        "id"
      ],
      "reactome": [
        "data_source",
        "data_source_url",
        "data_version",
        "id",
        "name"
      ]
    },
    "relations": {
      "ADJACENT_TO": {
        "paths": [
          {
            "source": [
              "anatomical_structure"
            ],
            "target": [
              "anatomical_structure"
            ],
            "records": 3
          }
        ],
        "properties": [
          "data_source",
          "data_version",
          "end_id",
          "start_id"
        ]
      },
      "ASSOCIATED_WITH_GO": {
        "paths": [
          {
            "source": [
              "Gene"
            ],
            "target": [
              "GO_term"
            ],
            "records": 471403
          }
        ],
        "properties": [
          "data_source",
          "data_source_url",
          "data_version",
          "end_id",
          "go_evidence_code",
          "start_id"
        ]
      },
      "EFFECTOR_GENE_OF": {
        "paths": [
          {
            "source": [
              "Gene"
            ],
            "target": [
              "disease",
              "ontology"
            ],
            "records": 256
          }
        ],
        "properties": [
          "data_source",
          "data_source_url",
          "data_version",
          "effector_gene_list_url",
          "end_id",
          "evidence",
          "start_id"
        ]
      },
      "FGSEA_ENRICHED_IN": {
        "paths": [
          {
            "source": [
              "ontology",
              "kegg"
            ],
            "target": [
              "anatomical_structure"
            ],
            "records": 12
          },
          {
            "source": [
              "ontology",
              "reactome"
            ],
            "target": [
              "anatomical_structure"
            ],
            "records": 69
          }
        ],
        "properties": [
          "cell_type_label",
          "data_source",
          "data_version",
          "end_id",
          "es",
          "leading_edge",
          "log2err",
          "nes",
          "padj",
          "pathway_collection",
          "pathway_name",
          "pathway_term",
          "pval",
          "size",
          "source_file",
          "start_id"
        ]
      },
      "FUNCTION_ANNOTATION": {
        "paths": [
          {
            "source": [
              "Gene"
            ],
            "target": [
              "ontology",
              "kegg"
            ],
            "records": 38462
          },
          {
            "source": [
              "Gene"
            ],
            "target": [
              "ontology",
              "reactome"
            ],
            "records": 48545
          }